{
  "schema_version": 1,
  "bug_id": "BUG-API-001",
  "title": "Reviewer accepted a changed error shape without checking the client contract",
  "status": "verified",
  "severity": "medium",
  "objective": "Keep independent review aligned with the declared request, response, and error contract.",
  "symptom": "A review was marked approved even though the proposed error response omitted a field required by the client contract.",
  "expected_behavior": "The reviewer requests changes when a client-visible error contract is incomplete or incompatible.",
  "actual_behavior": "The reviewer checked the success path but did not verify the error shape.",
  "reproduction": {
    "deterministic": true,
    "steps": [
      "Give the reviewer a plan with a success response and an incomplete error response.",
      "Ask the reviewer to check the implementation against the declared interface contract.",
      "Observe whether the missing error field is reported."
    ],
    "environment": {
      "host": "codex",
      "model": "example-model",
      "fixture": "evals/public/inputs/AF-003.md"
    }
  },
  "affected_slices": ["review", "cross-layer", "api-contract"],
  "attribution": "role_prompt",
  "root_cause": "The reviewer contract listed correctness and regressions but did not explicitly require checking request, response, and error compatibility.",
  "confidence": "high",
  "fix_hypothesis": "Make client-visible error and compatibility checks explicit in the reviewer contract and its evaluation cases.",
  "agentflow_version": "0.3.1",
  "source_revision": "example-diagnosis-revision",
  "evidence": [
    {
      "evidence_id": "E-API-TRACE",
      "kind": "trace",
      "ref": "evals/public/inputs/AF-003.md",
      "summary": "Sanitized reproduction input for the API contract review case."
    },
    {
      "evidence_id": "E-API-REVIEW",
      "kind": "review",
      "ref": "example-review-record",
      "summary": "Independent review result showing the missed error field."
    },
    {
      "evidence_id": "E-API-REGRESSION",
      "kind": "test",
      "ref": "evals/public/AF-003.json",
      "summary": "Regression case requiring error contract verification."
    }
  ],
  "regression_checks": [
    {
      "name": "reviewer checks request, response, and error contracts",
      "status": "pass",
      "command": "python3 tools/lab/validate.py evals/public",
      "evidence_refs": ["E-API-REGRESSION"]
    }
  ],
  "resolution": {
    "summary": "The reviewer contract and public evaluation case now explicitly require error-shape and compatibility checks.",
    "source_revision": "example-resolution-revision",
    "evidence_refs": ["E-API-REGRESSION"],
    "verified_at": "2026-09-13T23:30:00Z"
  },
  "review": {
    "reviewer": "independent-review-example",
    "decision": "approved",
    "evidence_refs": ["E-API-REVIEW"],
    "reviewed_at": "2026-09-13T23:35:00Z"
  },
  "known_boundaries": [
    "This example verifies workflow evidence only; it does not prove behavior for every host or model."
  ],
  "recorded_at": "2026-09-13T23:40:00Z"
}
